{
  "schemaVersion": "1.0.0",
  "kind": "ActuationIntent",
  "intentId": "intent.fixture-hold-01",
  "runId": "run.fixture-a0-01",
  "proposedAt": "2026-08-21T00:40:00Z",
  "expiresAt": "2026-08-21T00:45:00Z",
  "capabilityClass": "P3",
  "action": "propose-simulator-rehearsal",
  "executable": false,
  "rationale": "Non-executable proposal only. Live actuation is disabled."
}
